{
  "$schema": "../../schema/vehicle.schema.json",
  "schemaVersion": "1.0.0",
  "id": "01a17aa8-1c00-7605-bc9a-fb5ca9da250d",
  "legacyId": "man-lions-city-12c-presov",
  "name": "MAN Lion's City 12 (12C EfficientHybrid diesel, 3 doors (DPMP Prešov))",
  "manufacturer": "MAN",
  "builder": "MAN Truck & Bus",
  "model": "Lion's City 12",
  "variant": "12C EfficientHybrid diesel, 3 doors (DPMP Prešov)",
  "family": "Lion's City",
  "manufacturerCountry": "Germany",
  "type": "standard-bus",
  "mode": "bus",
  "operators": [
    "Dopravný podnik mesta Prešov"
  ],
  "length": {
    "value": 12.185,
    "unit": "m",
    "assumed": false,
    "basis": "cited",
    "sources": [
      "imhd-sk-man-lion-s-city-12c-vehicle-type-descrip"
    ]
  },
  "width": {
    "value": 2.55,
    "unit": "m",
    "assumed": false,
    "basis": "cited",
    "sources": [
      "imhd-sk-man-lion-s-city-12c-vehicle-type-descrip"
    ]
  },
  "height": {
    "value": 3.16,
    "unit": "m",
    "assumed": false,
    "basis": "cited",
    "sources": [
      "imhd-sk-man-lion-s-city-12c-vehicle-type-descrip"
    ]
  },
  "consist": {
    "articulations": {
      "value": 0,
      "unit": "count",
      "assumed": false,
      "basis": "cited",
      "sources": [
        "imhd-sk-man-lion-s-city-12c-vehicle-type-descrip"
      ]
    },
    "cars": {
      "value": 1,
      "unit": "count",
      "assumed": false,
      "basis": "cited",
      "sources": [
        "imhd-sk-man-lion-s-city-12c-vehicle-type-descrip"
      ]
    }
  },
  "doorsPerSide": {
    "value": 3,
    "unit": "count",
    "assumed": false,
    "basis": "cited",
    "sources": [
      "imhd-sk-man-lion-s-city-12c-vehicle-type-descrip"
    ]
  },
  "seats": {
    "value": 31,
    "unit": "count",
    "assumed": false,
    "basis": "cited",
    "sources": [
      "imhd-sk-man-lion-s-city-12c-vehicle-type-descrip"
    ]
  },
  "standingQuoted": {
    "value": 67,
    "unit": "count",
    "assumed": false,
    "basis": "cited",
    "sources": [
      "imhd-sk-man-lion-s-city-12c-vehicle-type-descrip"
    ]
  },
  "standingArea": {
    "value": 16.8,
    "unit": "m2",
    "assumed": true,
    "basis": "educated-guess",
    "sources": [
      "imhd-sk-man-lion-s-city-12c-vehicle-type-descrip"
    ],
    "rationale": "67 standing places; the source states no density, so 4 pers/m2 is assumed (range 3-6 pers/m2, the spread of densities manufacturers quote).",
    "low": 11.2,
    "central": 16.8,
    "high": 22.3,
    "distribution": "triangular"
  },
  "topSpeed": {
    "value": 80,
    "unit": "km/h",
    "assumed": false,
    "basis": "cited",
    "sources": [
      "imhd-sk-man-lion-s-city-12c-vehicle-type-descrip"
    ]
  },
  "power": {
    "value": 243,
    "unit": "kW",
    "assumed": false,
    "basis": "cited",
    "sources": [
      "imhd-sk-man-lion-s-city-12c-vehicle-type-descrip"
    ]
  },
  "energySource": {
    "value": "diesel",
    "assumed": false,
    "basis": "cited",
    "sources": [
      "imhd-sk-man-lion-s-city-12c-vehicle-type-descrip"
    ]
  },
  "notes": "MAN 12C Lion's City NL330 EfficientHybrid (built 2020), leased by DPMP in 2026. MAN D1556 LOH Euro 6 diesel, 243 kW, Voith DIWA 6-speed. Height with air conditioning. Wheelbase 6,005 mm. The source gives seats 31 + 2, standing 67 and total 100; the two extra seats (driver/folding) are not split out, so total is left to seated + standing (98). Livery not described.",
  "trademarkNotice": "Manufacturer, model and operator names are trademarks of their owners and are used for identification only."
}
