{
  "$schema": "../../schema/vehicle.schema.json",
  "schemaVersion": "1.0.0",
  "id": "01a17aa8-1c00-7fd7-8a88-f34e76ed62f5",
  "legacyId": "yutong-ic12e",
  "name": "Yutong IC12E (2026 battery-electric intercity bus)",
  "manufacturer": "Yutong",
  "builder": "Yutong",
  "model": "IC12E",
  "variant": "2026 battery-electric intercity bus",
  "family": "IC-series",
  "manufacturerCountry": "China",
  "type": "coach",
  "mode": "intercity_bus",
  "length": {
    "value": 12.66,
    "unit": "m",
    "assumed": false,
    "basis": "cited",
    "sources": [
      "zhengzhou-yutong-bus-yutong-ic12e-brochure-february-2026-edit"
    ]
  },
  "width": {
    "value": 2.55,
    "unit": "m",
    "assumed": false,
    "basis": "cited",
    "sources": [
      "zhengzhou-yutong-bus-yutong-ic12e-brochure-february-2026-edit"
    ]
  },
  "height": {
    "value": 3.5,
    "unit": "m",
    "assumed": false,
    "basis": "cited",
    "sources": [
      "zhengzhou-yutong-bus-yutong-ic12e-brochure-february-2026-edit"
    ]
  },
  "weightLoaded": {
    "value": 19.5,
    "unit": "t",
    "assumed": false,
    "basis": "cited",
    "sources": [
      "zhengzhou-yutong-bus-yutong-ic12e-brochure-february-2026-edit"
    ]
  },
  "consist": {
    "articulations": {
      "value": 0,
      "unit": "count",
      "assumed": false,
      "basis": "cited",
      "sources": [
        "zhengzhou-yutong-bus-yutong-ic12e-brochure-february-2026-edit"
      ]
    },
    "cars": {
      "value": 1,
      "unit": "count",
      "assumed": false,
      "basis": "cited",
      "sources": [
        "zhengzhou-yutong-bus-yutong-ic12e-brochure-february-2026-edit"
      ]
    }
  },
  "turningCircle": {
    "value": 19,
    "unit": "m",
    "assumed": false,
    "basis": "cited",
    "sources": [
      "zhengzhou-yutong-bus-yutong-ic12e-2026-technical-parameters"
    ]
  },
  "seats": {
    "value": 61,
    "unit": "count",
    "assumed": false,
    "basis": "cited",
    "sources": [
      "zhengzhou-yutong-bus-ic12e"
    ]
  },
  "standingQuoted": {
    "value": 0,
    "unit": "count",
    "assumed": false,
    "basis": "documented",
    "sources": [
      "zhengzhou-yutong-bus-ic12e",
      "zhengzhou-yutong-bus-yutong-ic12e-brochure-february-2026-edit"
    ],
    "rationale": "Total 61 minus 61 seats."
  },
  "standingArea": {
    "value": 0.0,
    "unit": "m2",
    "assumed": true,
    "basis": "educated-guess",
    "sources": [
      "zhengzhou-yutong-bus-ic12e",
      "zhengzhou-yutong-bus-yutong-ic12e-brochure-february-2026-edit"
    ],
    "rationale": "0 standing places; the source states no density, so 4 pers/m2 is assumed (range 3-6 pers/m2, the spread of densities manufacturers quote).",
    "low": 0.0,
    "central": 0.0,
    "high": 0.0,
    "distribution": "triangular"
  },
  "totalCapacityQuoted": {
    "value": 61,
    "unit": "count",
    "assumed": false,
    "basis": "cited",
    "sources": [
      "zhengzhou-yutong-bus-yutong-ic12e-brochure-february-2026-edit"
    ]
  },
  "topSpeed": {
    "value": 100,
    "unit": "km/h",
    "assumed": false,
    "basis": "cited",
    "sources": [
      "zhengzhou-yutong-bus-yutong-ic12e-brochure-february-2026-edit"
    ]
  },
  "energySource": {
    "value": "battery",
    "assumed": false,
    "basis": "cited",
    "sources": [
      "zhengzhou-yutong-bus-yutong-ic12e-brochure-february-2026-edit",
      "zhengzhou-yutong-bus-yutong-ic12e-2026-technical-parameters"
    ]
  },
  "batteryCapacity": {
    "value": 465.99,
    "unit": "kWh",
    "assumed": false,
    "basis": "cited",
    "sources": [
      "zhengzhou-yutong-bus-yutong-ic12e-brochure-february-2026-edit",
      "zhengzhou-yutong-bus-yutong-ic12e-2026-technical-parameters"
    ]
  },
  "range": {
    "value": 675,
    "unit": "km",
    "assumed": false,
    "basis": "cited",
    "sources": [
      "zhengzhou-yutong-bus-yutong-ic12e-brochure-february-2026-edit",
      "zhengzhou-yutong-bus-yutong-ic12e-2026-technical-parameters"
    ]
  },
  "notes": "Brochure: maximum number of passengers 61; the parameter page says 'up to 59+1+1' seats, so seated is left empty. Battery 399.92 kWh standard, 465.99 kWh optional; range up to 675 km (SORT2) with the larger battery. Rated power 215/250/430 kW by configuration.",
  "trademarkNotice": "Manufacturer, model and operator names are trademarks of their owners and are used for identification only."
}
